Subject,Title,Author,ISBN,Price,Currency,Pages,Publication_Year,Category,Image_URL,Book_URL,Description,Updated_At,Discount,Visible
For Dummies,Microsoft Office 2019 For Dummies,Wallace Wang,9788126578559,849,INR,436,2018,General,/images/books/9788126578559.jpg,https://www.wileyindia.com/for-dummies/microsoft-office-2019-for-dummies.html,"Microsoft Office basics including typing and formatting text in Word, designing your Word documents, navigating an Excel spreadsheet, editing a spreadsheet, creating formulas, charting and analyzing data, creating a PowerPoint presentation, adding color, pictures, and sound to a presentation, preparing your presentation for an audience, configuring e-mail with Outlook, storing contacts and organizing tasks, scheduling your time and setting appointments, designing an Access database, editing and modifying a database, searching, sorting, and querying a database, creating a database report, and more. Information is presented in the straightforward but fun language that has defined the Dummies series for more than twenty years.",,,true
For Dummies,Gamification Marketing For Dummies,Zarrar Chishti,9789354245763,749,INR,312,2021,General,/images/books/9789354245763.jpg,https://www.wileyindia.com/for-dummies/gamification-marketing-for-dummies.html,"Nothing drives interest from customers more than giving them the chance to win. From old school sweepstakes and stamp collecting games to modern mobile loyalty programs or branded game apps, gamification helps connect you to your customers in a way they invite into their lives. This book helps you add the effective but challenging aspects of gamification to your marketing strategy. No matter what your digital proficiency, Intelligent Marketing with Gamification For Dummies will guide both veteran and inexperienced marketers through the maze of planning and executing a gamification strategy.",,,true
For Dummies,CCSP For Dummies with Online Practice,Arthur J. Deane,9789354245770,959,INR,380,2021,General,/images/books/9789354245770.jpg,https://www.wileyindia.com/for-dummies/ccsp-for-dummies-with-online-practice.html,"If you are a cloud security professional seeking your CSSP certification, this book is a perfect way to prepare for the exam. Covering in detail all six domains, the expert advice in this book gives you key information you'll need to pass the exam. In addition to the information covered on the exam, you'll get tips on setting up a study plan, tips for exam day, and access to an online test bank of questions.",,,true
For Dummies,"Lean Six Sigma for Dummies, 3ed","John Morgan , Martin Brenig-Jones",9789354249969,799,INR,378,2021,General,/images/books/9789354249969.jpg,https://www.wileyindia.com/for-dummies/lean-six-sigma-for-dummies-3ed.html,"Are you looking to make your organisation more effective and productive? If you answered ""yes,"" you need to change the way it thinks. Combining the leading improvement methods of Six Sigma and Lean, this winning technique drives performance to the next level—and this friendly and accessible guide shows you how. The third edition of Lean Six Sigma For Dummies outlines the key concepts of this strategy and explains how you can use it to get the very best out of your team and your business.",,,true
For Dummies,"Mindfulness for Dummies, 3ed",Shamash Alidina,9789388991162,749,INR,404,2020,General,/images/books/9789388991162.jpg,https://www.wileyindia.com/for-dummies/mindfulness-for-dummies-3ed.html,"Are you tired, unproductive or stressed out? Maybe you're suffering from high-blood pressure, illness or even chronic pain? Recommended by medical professionals throughout the UK, mindfulness helps to clear the mind of the distracting thoughts and mental clutter that accumulate day-to-day. Focusing on breathing and other self-control techniques, mindfulness is scientifically proven to leave patients calmer, more self-aware, and free from the unrealistic expectations that damage the way we all live and work. And with this expert, easy-to-follow guide, there's never been a better time to get to grips with mindfulness and the many ways it can help you lead a happier, healthier life.",,,true
For Dummies,"Cognitive Behavioural Therapy for Dummies, 3ed","Rob Willson, Rhena Branch",9789388991179,749,INR,444,2020,General,/images/books/9789388991179.jpg,https://www.wileyindia.com/for-dummies/cognitive-behavioural-therapy-for-dummies-3ed.html,"Cognitive Behavioural Therapy For Dummies, 3rd Edition will help readers identify negative and unhealthy patterns of thinking which have been holding them back from the changes they want. CBT can help readers overcome anxiety and depression, boost self-esteem, lose weight, manage anger, beat addiction or simply improve their outlook in both their professional and personal lives. The straightforward and practical advice will help readers apply CBT principles to their own lives, whatever issues they'd like to work on.",,,true
For Dummies,"Social Media Marketing for Dummies, 4ed","Shiv Singh, Stephanie Diamond",9789388991186,639,INR,460,2020,General,/images/books/9789388991186.jpg,https://www.wileyindia.com/for-dummies/social-media-marketing-for-dummies-4ed.html,"Social Media Marketing For Dummies, 4th Edition presents the essence of planning, launching, managing, and assessing a social marketing campaign in an economic 350-page guide - perfect for time-pressed marketers. This edition brings the existing content up to date for 2019 and adds new content as well.",,,true
For Dummies,Data Science Programming All - in - One for Dummies,"John Paul Mueller, Luca Massaron",9789388991209,1059,INR,780,2020,Technology,/images/books/9789388991209.jpg,https://www.wileyindia.com/for-dummies/data-science-programming-all-in-one-for-dummies.html,"Most of the books on the market are written for the science professional and often limit their audience to a reader specializing in data science, AI, or computer science. These books focus on people who already have the coding knowledge to write applications, the math background to work with algorithms, and the data management background to interact with data sources successfully. This book addresses their needs by providing simple techniques to access data, manipulate it using clearly described algorithms, and interacting with it using code written in one of three languages. The result is a book that has a broad audience of people who need this resource.",,,true
For Dummies,Python All - in - One For Dummies,"John Shovic, Alan Simpson",9789388991216,1019,INR,712,2020,Technology,/images/books/9789388991216.jpg,https://www.wileyindia.com/for-dummies/python-all-in-one-for-dummies.html,"There's almost no type of project that Python can't make better. From creating apps to building complex web sites to sorting big data, Python provides a way to get the work done. Python All-in-One For Dummies offers a starting point for those new to coding by explaining the basics of Python. Experienced coders looking for more than the basics can also find how Python can be applied to projects in the enterprise, including data analysis and other major undertakings.",,,true
For Dummies,"Microsoft Excel Formulas & Functions For Dummies, 5ed",Ken Bluttman,9789390466733,889,INR,,2020,General,/images/books/9789390466733.jpg,https://www.wileyindia.com/for-dummies/microsoft-excel-formulas-functions-for-dummies-5ed.html,"There are more than 400 built-in functions in Excel X, from AGGREGATE to Z.TEST. The question is which ones will make my work easier? How and why should I use a particular function in my formulas? Excel Formulas and Functions For Dummies, 5 th Edition is a thorough but easy-to-read coverage of powerful Excel functions. This book gives detailed step-by-step instruction on Excel's 150 most useful functions. The use of each function will be illustrated by helpful, real-world examples showing how a function is used within a formula. Another 85 specialized functions will be described in abbreviated form.",,,true
Chemistry,Corrosion Of Nickel-Based Alloys,Sridhar,9780470122037,190.95,USD,432,2026,General,/images/books/9780470122037.webp,,"Corrosion of Nickel-Based Alloys provides a comprehensive overview of the history, metallurgy, and corrosion performance of nickel-based alloys. Blending fundamental scientific principles with practical industrial applications, the book explores corrosion mechanisms, alloy selection, and modeling approaches used across industries such as nuclear, oil and gas, aerospace, marine, and chemical engineering. An essential resource for engineers, researchers, consultants, and students working with corrosion-resistant materials.",2026-05-18T10:58:03.222Z,20,true
Computer Science,The Web Of Knowledge: Encyclopedias And Authority In The Digital Age,Alevizou,9780745646282,69.95,USD,336,2026,Computer,/images/books/9780745646282.webp,,"The Web of Knowledge explores the evolution of encyclopedias in the digital age, with a special focus on Wikipedia and online knowledge cultures. Blending historical analysis with contemporary case studies, the book examines how technology, media, and public participation have transformed the creation, governance, and accessibility of knowledge. An insightful resource for students and scholars of digital media, information science, and cultural studies.",2026-05-19T08:42:23.180Z,20,true
Biology,"Flow Cytometry: First Principles, Third Edition",Givan,9781119508113,104.93,USD,336,2026,Science,/images/books/9781119508113.webp,,"Flow Cytometry: First Principles is a comprehensive introduction to the principles, instrumentation, and applications of flow cytometry. Covering topics from cell analysis and sorting to clinical diagnostics and molecular biology, the book explains both fundamental concepts and advanced techniques in a clear, accessible manner. Richly illustrated and updated with modern applications, it serves as an essential resource for scientists, clinicians, students, and researchers working in biomedical and life sciences.",2026-05-18T10:58:25.885Z,20,true
Engineering,Virtual And Augmented Reality - Fundamentals And Applications,Bhowmik,9781119615927,139.95,USD,688,2026,Engineering,/images/books/9781119615927.webp,,"Virtual and Augmented Reality: Fundamentals and Applications provides a comprehensive introduction to the principles, technologies, and real-world applications of virtual and augmented reality. Covering topics such as immersive system design, human sensory perception, AI-driven interaction, 3D graphics, spatial audio, and motion tracking, the book bridges foundational theory with practical implementation. Featuring case studies across healthcare, education, entertainment, tourism, and industry, it is an essential resource for students, researchers, engineers, and professionals working in immersive technologies.",2026-05-18T10:58:35.181Z,20,true
"Business Management, Finance & Accounting",Deep Learning In Quantitative Finance,Green,9781119685241,92,USD,736,2026,Management,/images/books/9781119685241.webp,,"Deep Learning in Quantitative Finance offers a practical and comprehensive guide to applying deep learning techniques in modern quantitative finance. Covering neural networks, advanced deep learning models, and real-world financial applications, the book explores topics such as derivative pricing, volatility modeling, market data generation, and hedging strategies. Supported by Python-based Jupyter notebooks and case studies, it is an essential resource for quantitative analysts, finance professionals, researchers, and students interested in the future of AI-driven finance.",2026-05-18T10:58:46.102Z,20,true
Biology,Veterinary Microbiology And Microbial Disease 3Rd Edition,Quinn,9781119716785,120.95,USD,1008,2026,Medical,/images/books/9781119716785.webp,,"Veterinary Microbiology and Microbial Disease is a comprehensive guide to infectious diseases in veterinary medicine, covering bacteriology, virology, and mycology with a strong focus on animal and public health. Updated with advances in molecular diagnostics, genome sequencing, antimicrobial resistance, and emerging zoonotic threats, the book combines foundational microbiology with practical clinical applications. Richly illustrated and supported by online educational resources, it is an essential reference for veterinary students, clinicians, researchers, and diagnostic specialists.",2026-05-18T10:58:55.278Z,20,true
Engineering,Fundamentals Of Power System Resilience - Disruptions By Natural Causes,Panteli,9781119815990,138.94,USD,272,2026,Engineering,/images/books/9781119815990.webp,,"Fundamentals of Power System Resilience provides a comprehensive introduction to the concepts, assessment methods, and planning strategies for resilient power systems. Addressing challenges posed by natural hazards such as wildfires, floods, earthquakes, and blackouts, the book combines theoretical foundations with practical case studies from around the world. Covering resilience metrics, system reliability, asset failure modeling, and low-carbon grid planning, it is an essential resource for students, researchers, regulators, and energy industry professionals.",2026-05-18T10:59:05.282Z,20,true
Engineering,"Algorithms For Smart World Technologies: A Comprehensive Guide To Applications In Ai, Iot And Automation For Electrical And Computer Engineers",Saha,9781119823612,134.95,USD,272,2026,Engineering,/images/books/9781119823612.webp,,"Algorithms for Smart World Technologies provides a comprehensive guide to the design and implementation of algorithms for modern smart technologies, including AI, IoT, Blockchain, and intelligent transportation systems. Covering algorithmic complexity, ethical considerations, search techniques, and real-world applications, the book combines foundational theory with practical case studies, exercises, and projects. It is an essential resource for developers, researchers, students, and technology professionals working on smart-world solutions.",2026-05-18T10:59:17.538Z,20,true
Engineering,Print Technologies And The Emergence Of American Literary Cultures,Scheiding,9781119825166,35.95,USD,240,2026,Technology,/images/books/9781119825166.webp,,"Print Technologies and the Emergence of American Literary Cultures explores how print, oral, visual, and material media shaped early American literary cultures from pre-Columbian times to the nineteenth century. Combining literary analysis with media theory and archival research, the book examines Indigenous writings, print circulation, and the works of influential early American authors to reveal the interconnected nature of cultural expression and literary production. An insightful resource for students and scholars of American literature, media studies, print culture, and transatlantic studies.",2026-05-18T10:59:26.270Z,20,true
General,Popular Music And American Literary Culture,Curnutt,9781119833222,35.95,USD,336,2026,General,/images/books/9781119833222.webp,,"Popular Music and American Literary Culture: Reading the Beat explores how American writers have represented the energy, influence, and cultural significance of popular music from rhythm and blues to hip-hop. Through literary analysis and cultural history, the book examines how novels, poetry, and drama have engaged with evolving musical movements, reflecting broader conversations about identity, race, authenticity, and artistic expression. An engaging resource for students, scholars, and readers interested in the intersection of music, literature, and American culture.",2026-05-18T10:59:49.575Z,20,true
Chemistry,"The Organometallic Chemistry Of The Transition Metals, 8Th Edition",Crabtree,9781119878513,135.95,USD,576,2026,General,/images/books/9781119878513.webp,,"The Organometallic Chemistry of the Transition Metals offers a comprehensive and up-to-date introduction to the principles, reactivity, and applications of transition metal organometallic compounds. Covering key concepts such as bonding, electron counting, reaction mechanisms, catalysis, and metal carbenes, the book also explores emerging topics including nanoclusters, photocatalysis, computational chemistry, and alternative energy applications. Widely regarded as a leading text in the field, it is an essential resource for advanced students, researchers, and practising chemists in organometallic and inorganic chemistry.",2026-05-18T11:00:01.753Z,20,true
General,"Handbook Of Research Methods In Developmental Science, 2Nd Edition",Teti,9781119880820,96.95,USD,688,2026,General,/images/books/9781119880820.webp,,"The Handbook of Research Methods in Developmental Science provides a comprehensive overview of contemporary research methodologies used in the study of human development. Featuring updated chapters on advanced research designs, causal inference, intervention science, and data analysis techniques, the book combines theoretical foundations with practical guidance and real-world applications. An essential resource for graduate students, researchers, and professionals in developmental psychology, education, and social sciences.",2026-05-18T11:00:11.725Z,20,true
Chemistry,"Medical Toxicology Of Occupational And Environmental Exposures, Volume 2: Radiation: Risk Assessment, Diagnostic Tests, And Therapeutics",Barceloux,9781119881254,200.95,USD,512,2026,General,/images/books/9781119881254.webp,,"Medical Toxicology of Occupational and Environmental Exposures is a comprehensive reference on the clinical, analytical, and monitoring aspects of occupational and environmental toxicology. Covering topics such as metals, radiation, and chemical carcinogens, the book provides evidence-based guidance on exposure assessment, diagnosis, health surveillance, and treatment. Volume 2, Radiation Risk Assessment, Diagnostic Tests, and Therapeutics, focuses specifically on the science and clinical practice of radiation toxicology, making it an essential resource for clinicians, researchers, toxicologists, and regulatory professionals.",2026-05-18T11:00:23.529Z,20,true
General,"Culture, Nature, And Environmental Sustainability: An Anthropological Introduction",Vivanco,9781119886754,47.95,USD,432,2026,General,/images/books/9781119886754.webp,,"Culture, Nature, and Environmental Sustainability: An Anthropological Introduction explores global environmental challenges through the lens of environmental anthropology, connecting culture, ecology, politics, and sustainability. Using real-world case studies and diverse perspectives, the book examines topics such as climate change, conservation, food systems, environmental justice, and human-environment relationships. Combining theory, ethnography, and practical learning tools, it is an essential resource for students and scholars in anthropology, environmental studies, geography, and sustainability studies.",2026-05-18T11:00:33.852Z,20,true
Chemistry,Climate Change Chemistry: Principles And Mitigation Strategies,Heagy,9781119891376,114.95,USD,384,2026,General,/images/books/9781119891376.webp,,"Climate Change Chemistry explores the chemical foundations of climate change and greenhouse gas mitigation, combining environmental chemistry with quantum chemistry and molecular science. The book examines topics such as acid rain, ozone depletion, greenhouse gases, photocatalysis, artificial photosynthesis, and solar fuels while highlighting chemical solutions to global environmental challenges. Designed for advanced students and professionals in chemistry, chemical engineering, and materials science, it provides both theoretical foundations and practical perspectives on sustainable technologies.",2026-05-18T11:00:49.689Z,20,true
General,The Life Of The Author - Geoffrey Chaucer,Marshall,9781119987291,29.95,USD,144,2026,General,/images/books/9781119987291.webp,,"The Life of the Author: Geoffrey Chaucer explores how generations of biographers have shaped, reinvented, and sometimes fabricated the life of Geoffrey Chaucer to reflect the values and concerns of their own times. Drawing on biographies spanning nearly 625 years, Simone Celine Marshall examines how ideas of authorship, nationalism, morality, and cultural identity have influenced portrayals of Chaucer, offering a fascinating study of how literary lives are continually rewritten across history.",2026-05-18T11:01:00.231Z,20,true
General,Cultural Responsivity: Treatment Of Sexual Violence,Dickie,9781394161003,68.95,USD,240,2026,General,/images/books/9781394161003.webp,,"Cultural Responsivity: Treatment of Sexual Violence examines the importance of culturally responsive approaches in the treatment and rehabilitation of individuals who have engaged in sexually aggressive behaviour. Drawing on insights from forensic psychology and social sciences, the book explores how factors such as age, gender identity, religion, and culture influence therapeutic engagement and outcomes. Combining theoretical perspectives with practical intervention strategies, it is an essential resource for students, researchers, and professionals in forensic psychology, criminology, counselling, and rehabilitation services.",2026-05-18T11:01:10.136Z,20,true
General,The Handbook Of Journalism And Emotion,Soto-Sanfiel,9781394169382,190.95,USD,528,2026,General,/images/books/9781394169382.webp,,"The Handbook of Journalism and Emotions: Theory, Production, Content and Responses explores how emotions shape modern journalism across news production, storytelling, audience engagement, and media culture. Bringing together global perspectives and interdisciplinary research, the book examines topics such as emotional labour in reporting, audience responses, visual storytelling, misinformation, and conflict journalism. Covering both traditional and digital media, it is an essential resource for students, scholars, journalists, and media professionals interested in the emotional dimensions of contemporary journalism.",2026-05-18T11:01:23.015Z,20,true
Engineering,"Rocket Propulsion Elements, Tenth Edition",Sutton,9781394187201,150.95,USD,704,2026,Engineering,/images/books/9781394187201.webp,,"Rocket Propulsion Elements, Tenth Edition, is a comprehensive and best-selling guide to the principles and applications of rocket propulsion. Updated with the latest industry advancements, the book covers liquid, solid, hybrid, and electric propulsion systems, along with modern technologies such as additive manufacturing, reusable launch vehicles, and advanced propellants. Combining theory with practical applications, it serves as an essential resource for students, engineers, and professionals in aerospace and mechanical engineering.",2026-05-18T11:01:43.192Z,20,true
General,The Handbook Of Inoculation Theory,Ivanov,9781394199358,200.95,USD,512,2026,General,/images/books/9781394199358.webp,,"The Handbook of Inoculation: Theory and Practice provides a comprehensive exploration of inoculation theory and its role in understanding resistance to persuasion, misinformation, and social influence. Bringing together research and real-world applications from fields such as political communication, public health, marketing, education, and journalism, the book examines both foundational concepts and modern strategies for inoculation-based interventions. An essential resource for students, researchers, and professionals in communication, psychology, sociology, and related disciplines.",2026-05-18T11:01:53.823Z,20,true
"Business Management, Finance & Accounting","Business Valuation: Fundamentals, Techniques, And Theory",Nacva,9781394204731,199.95,USD,464,2026,General,/images/books/9781394204731.webp,,"Business Valuation: Fundamentals, Techniques, and Theory provides a comprehensive guide to the principles, methods, and practices of private enterprise valuation. Covering topics such as valuation methodologies, cost of capital, financial statement analysis, earnings assessment, and valuation discounts and premiums, the book combines theoretical foundations with practical case-based applications. Widely used in professional training, it is an essential resource for business valuators, accountants, financial advisors, consultants, analysts, and students in finance and business disciplines.",2026-05-18T11:02:07.209Z,20,true
General,"Blackwell'S Five-Minute Veterinary Consult Clinical Companion: Canine And Feline Behavior, Third Edition",Pike,9781394204915,174.95,USD,1280,2026,General,/images/books/9781394204915.webp,,"Blackwell’s Five-Minute Veterinary Consult Clinical Companion: Canine and Feline Behaviour is a practical and evidence-based guide to diagnosing, treating, and preventing behavioural problems in dogs and cats. Covering issues such as anxiety, aggression, compulsive behaviours, roaming, and inappropriate vocalisation, the book provides quick-access clinical guidance, behaviour screening tools, treatment strategies, and client resources. Updated with new research, visual learning materials, and practical protocols, it is an essential reference for veterinarians, veterinary technicians, and veterinary students.",2026-05-18T11:02:17.745Z,20,true
"Business Management, Finance & Accounting",Work Is Personal: How Authenticity Drives Performance And Culture,Kelly,9781394208999,27.95,USD,240,2026,Management,/images/books/9781394208999.webp,,"Work Is Personal: How Authenticity Drives Performance and Culture explores how authentic human connections in the workplace can improve employee engagement, loyalty, and organizational performance. Covering topics such as talent acquisition, onboarding, performance management, employee development, and workplace culture, the book combines practical strategies with real-world examples to help leaders create more people-centered organizations. It is an insightful resource for managers, HR professionals, and business leaders focused on building stronger workplace relationships and high-performing teams.",2026-05-18T11:02:29.942Z,20,true
