Subject,Title,Author,ISBN,Price,Currency,Pages,Publication_Year,Category,Image_URL,Book_URL,Description,Updated_At,Discount,Visible
"Business Management, Finance & Accounting","Leading Relationships: Build Meaningful Connections, Eliminate Conflict, And Radically Improve Engagement",Mcclatchy,9781394289387,27.95 ,$,256,2025,Management,/images/books/9781394289387.webp,,"Leading Relationships by Steve McClatchy is a practical guide to improving workplace relationships, communication, and leadership effectiveness. Using his Five Levels of Maturity framework, the book teaches readers how to build trust, handle conflict, give constructive feedback, and manage workplace challenges like gossip, criticism, and disrespect. It is a valuable resource for leaders, managers, HR professionals, and teams seeking stronger and more productive workplace relationships.",2026-05-27T11:30:10.892Z,20,true
General,Ibs For Dummies,Campbell,9781394289455,24.95 ,$,352,2025,General,/images/books/9781394289455.webp,,"IBS For Dummies is a practical and easy-to-understand guide to Irritable Bowel Syndrome (IBS), covering symptoms, diagnosis, treatment options, and lifestyle management. The book explains the digestive system, gut microbiome, and gut-brain connection while offering IBS-friendly recipes, coping strategies, and the latest research to help readers manage symptoms and improve daily life.",2026-05-27T11:30:10.892Z,20,true
Computer Science,Stakeholder Whispering: Uncover What People Need Before Doing What They Ask,Shander,9781394289523,34.95 ,$,256,2025,Computer,/images/books/9781394289523.webp,,"Stakeholder Whispering by Bill Shander teaches how to uncover what people truly need beyond what they ask for. The book helps readers improve communication, make better strategic decisions, and build stronger collaboration by understanding the deeper goals of clients, customers, colleagues, and stakeholders. It is a valuable guide for leaders, managers, entrepreneurs, designers, and professionals who want to create more meaningful and effective solutions.",2026-05-27T11:30:10.892Z,20,true
Computer Science,Securing The Aws Cloud - A Guide For Learning To Secure Aws Infrastructure,Carroll,9781394289554,57.95 ,$,384,2025,Computer,/images/books/9781394289554.webp,,"Securing the AWS Cloud by Brandon Carroll is a practical guide to protecting and managing AWS cloud infrastructure securely. Covering both basic and advanced AWS security practices, the book teaches readers about identity management, threat detection, data protection, resilience, and recovery strategies. It is an ideal resource for IT professionals, system administrators, and anyone looking to build secure and reliable AWS environments.",2026-05-27T11:30:10.892Z,20,true
Engineering,"Project Management - A Systems Approach To Planning, Scheduling, And Controlling, 14Th Edition",Kerzner,9781394290031,120.95 ,$,720,2025,Engineering,/images/books/9781394290031.webp,,"Project Management: A Systems Approach to Planning, Scheduling, and Controlling (14th Edition) by Harold Kerzner is a comprehensive guide to modern project management, covering AI, agile and hybrid methodologies, risk management, sustainability, and data-driven decision-making. Aligned with the PMBOK® Guide, the book provides practical frameworks and real-world strategies for managing projects successfully, making it an essential resource for students, PMP® candidates, and project professionals.",2026-05-27T11:30:10.892Z,20,true
Computer Science,Beginning Solidity: Learn To Program Smart Contracts With Solidity,Dolgov,9781394290611,57.95 ,$,576,2025,Computer,/images/books/9781394290611.webp,,"Beginning Solidity by Alexandros Dolgov is a beginner-friendly guide to developing smart contracts and decentralized applications on the Ethereum blockchain using Solidity. The book explains blockchain fundamentals, Ethereum concepts, NFTs, ERC-20 tokens, wallets, and smart contract deployment through practical examples and real-world projects. It is an ideal resource for aspiring developers and programmers looking to build blockchain-based applications with Solidity and Ethereum.",2026-05-27T11:30:10.892Z,20,true
General,"Classroom Management: Creating A Successful K-12 Learning Community, 8Th Edition",Burden,9781394291700,182.95 ,$,320,2025,General,/images/books/9781394291700.webp,,"Classroom Management: Creating a Successful K-12 Learning Community (8th Edition) is a practical guide for teachers to build positive, inclusive, and well-managed classrooms. The book covers student behavior, discipline strategies, teacher-student relationships, classroom rules, equity, motivation, and student well-being, offering real-world methods and tools for K-12 educators and teachers in training.",2026-05-27T11:30:10.892Z,20,true
"Business Management, Finance & Accounting",Communicating Financials To Executives,Liu-Lindberg,9781394292608,47.00 ,$,304,2025,Management,/images/books/9781394292608.webp,,"Communicating Financials to Executives by Anders Liu-Lindberg and Christian Frantz Hansen is a practical guide to presenting financial information clearly and effectively to business leaders. The book provides a five-step approach to simplify complex financial data, improve executive decision-making, create impactful reports, and use visual communication techniques that make financial insights easier to understand and more valuable for organizations.",2026-05-27T11:30:10.892Z,20,true
Engineering,"Analysis Of Electric Machinery And Drive Systems, 4Th Edition",Krause,9781394293865,143.95 ,$,496,2025,Engineering,/images/books/9781394293865.webp,,"Analysis of Electric Machinery and Drive Systems (4th Edition) provides a comprehensive understanding of electric machines, motor drives, and power-electronic systems. The book covers induction machines, synchronous machines, brushless DC motors, torque control, converters, and drive systems with updated chapters, practical examples, and end-of-chapter problems. It is an essential resource for electrical engineering students and professionals working in electric drives and power systems.",2026-05-27T11:30:10.892Z,20,true
Chemistry,"Degradation, Stabilization, And Recycling Of Packaging Materials",Rabnawaz,9781394294268,154.95 ,$,384,2025,General,/images/books/9781394294268.webp,,"Degradation, Stabilization, and Recycling of Packaging Materials explores how packaging materials such as plastics, paper, glass, wood, and metals degrade under environmental conditions and how they can be stabilized and recycled effectively. The book covers sustainable packaging design, waste management, recycling technologies, and eco-friendly practices, making it a valuable resource for students, researchers, and packaging industry professionals.",2026-05-27T11:30:10.892Z,20,true
Engineering,"Project Management Case Studies, 7Th Edition",Kerzner,9781394294411,75.95 ,$,896,2025,Engineering,/images/books/9781394294411.webp,,"Project Management Case Studies (7th Edition) provides real-world case studies from industries such as technology, healthcare, aerospace, and automotive to demonstrate effective project management practices and common challenges. Updated with topics like AI, Agile, and hybrid project management, the book helps readers understand practical project management strategies and prepares students and professionals for the PMP certification exam.",2026-05-27T11:30:10.892Z,20,true
Engineering,"Hybrid Electric Vehicles: Principles And Applications With Practical Perspectives, Third Edition",Mi,9781394295128,163.95 ,$,576,2025,Engineering,/images/books/9781394295128.webp,,"Hybrid Electric Vehicles: Principles and Applications with Practical Perspectives provides a comprehensive introduction to hybrid and electric vehicle technologies, including HEVs, plug-in hybrids, fuel-cell vehicles, and hybrid-hydraulic systems. The book covers propulsion systems, power and energy management, battery charging, cybersecurity, diagnostics, and modern HEV technologies with real-world examples such as the Toyota Prius and Honda Civic. It is an essential resource for automotive engineers, researchers, and students studying electric and hybrid vehicle systems.",2026-05-27T11:30:10.892Z,20,true
"Business Management, Finance & Accounting",The Archetype Effect: Unlocking The Six Types Of Motivation At Work,Root,9781394295210,28.95 ,$,224,2025,Management,/images/books/9781394295210.webp,,"The Archetype Effect presents a research-based framework that identifies six worker archetypes—Givers, Operators, Explorers, Artisans, Strivers, and Pioneers—based on what motivates people at work. Drawing on global research across 19 countries, the book explores how modern trends like remote work, gig work, and AI are changing workplace motivation, helping individuals and leaders improve employee engagement, performance, and career growth.",2026-05-27T11:30:10.892Z,20,true
"Business Management, Finance & Accounting",Digital Impact: The Human Element Of Ai-Driven Transformation,Lucas,9781394295241,29.95 ,$,288,2025,Management,/images/books/9781394295241.webp,,"Digital Impact by Steve Lucas explores how organizations can use AI, automation, and connected technologies to solve real-world problems and create positive social impact. Through inspiring real-world examples, the book explains how businesses can overcome data complexity and digital fragmentation to improve sustainability, education, financial wellbeing, and humanitarian efforts. It serves as a practical guide for leaders driving AI-powered digital transformation.",2026-05-27T11:30:10.892Z,20,true
Engineering,"Advanced Techniques For Optimal Sizing Of Analog Integrated Circuits - Quantum Computing, Machine  Learning, And Bio-Inspired Optimization",Hoang,9781394296231,143.95 ,$,176,2025,Engineering,/images/books/9781394296231.webp,,"Advanced Techniques for Optimal Sizing of Analog Integrated Circuits explores modern methods for optimizing analog IC design using advanced algorithms, machine learning, and quantum computing approaches. The book covers circuit sizing techniques, optimization models, and bio-inspired algorithms such as particle swarm, firefly, cuckoo search, and bat algorithms. It is a valuable resource for researchers, engineers, and students in integrated circuit design, machine learning, and optimization.",2026-05-27T11:30:10.892Z,20,true
General,Black. Fat. Femme.: Revealing The Power Of Visibly Queer Voices In Media And Learning To Love Yourself,Higgins,9781394296361,27.95 ,$,240,2025,General,/images/books/9781394296361.webp,,"Black. Fat. Femme. by Dr. Jonathan P. Higgins explores identity, self-love, and representation through the experiences of Black Fat Femme individuals. The book examines the importance of authentic LGBTQ+ representation in media, highlights influential public figures, and discusses how marginalized voices are often excluded from mainstream conversations. It is a powerful reflection on visibility, identity, and embracing oneself unapologetically.",2026-05-27T11:30:10.892Z,20,true
Mathematics & Statistics,Fractions For Dummies,Zegarelli,9781394296873,19.95 ,$,288,2025,General,/images/books/9781394296873.webp,,"Fractions For Dummies by Mark Zegarelli is an easy-to-understand guide to mastering fractions, decimals, and percentages. The book explains basic and advanced fraction concepts, including mixed numbers, arithmetic operations, and word problems, while providing practical strategies to help students and learners build confidence in math.",2026-05-27T11:30:10.892Z,20,true
Computer Science,Zero To Engineer - The Unconventional Blueprint To Securing A 6-Figure It Career.,Kim,9781394297849,24.95 ,$,240,2025,Computer,/images/books/9781394297849.webp,,"Zero to Engineer by Terry Kim is a practical guide to starting or transitioning into a successful IT and cybersecurity career. The book provides step-by-step career pathways, job-ready skills, certification guidance, salary negotiation tips, and career-building strategies to help readers secure high-paying tech jobs—even without a traditional degree. It is ideal for beginners, career changers, and aspiring IT professionals.",2026-05-27T11:30:10.892Z,20,true
General,Mad About Money: Managing Finances (And Life) With Adhd,Alexander-Grout,9781394299720,21.99 ,$,432,2025,General,/images/books/9781394299720.webp,,"Mad About Money by Maddy Alexander-Grout is an honest and inspiring guide to managing money and life as a neurodivergent person with ADHD and autism. Through personal experiences and practical advice, the book explores financial struggles, debt, spending habits, mental health, parenting, and business challenges while offering actionable strategies to better understand neurodivergent thinking and build a more balanced life.",2026-05-27T11:30:10.892Z,20,true
General,Unraveling Your Relationship With Money: Ditch Your Money Trauma So You Can Live An Abundant Life,Game,9781394299850,27.95 ,$,224,2025,General,/images/books/9781394299850.webp,,"Unraveling Your Relationship with Money by Shannah Game explores how emotions, trauma, and mindset shape financial habits and decisions. Through real-life stories and practical guidance, the book helps readers overcome fear, shame, anxiety, and limiting beliefs about money to build healthier financial behaviors, emotional stability, and long-term abundance.",2026-05-27T11:30:10.892Z,20,true
General,Women And Wealth: A Playbook To Empower Clients And Unlock Their Fortune,Carbonaro,9781394300273,34.95 ,$,400,2025,General,/images/books/9781394300273.webp,,"Women and Wealth by Cary Carbonaro is a practical guide for financial professionals looking to better understand and serve female clients. The book explores women’s financial behaviors, decision-making psychology, and expectations for personalized advice while offering actionable strategies to improve client relationships, retention, and wealth management services for women.",2026-05-27T11:30:10.892Z,20,true
Engineering,"Signals, Systems, And Transforms - Concise Coverage From Theory To Application",Cohen,9781394300846,143.95 ,$,224,2025,Engineering,/images/books/9781394300846.webp,,"Signals, Systems, and Transforms provides a concise and practical introduction to analyzing analog and discrete signals using Fourier transforms, Laplace transforms, Z-transforms, FFT, and related tools. The book combines theory with real-world applications in signal processing, biomedical imaging, audio/video filtering, and system analysis, along with MATLAB-based examples and exercises for hands-on learning. It is an essential resource for electrical and computer engineering students.",2026-05-27T11:30:10.892Z,20,true
Computer Science,Explainable And Responsible Artificial Intelligence In Healthcare,Malviya,9781394302413,204.95 ,$,384,2025,Computer,/images/books/9781394302413.webp,,"This book explores how Explainable AI (XAI) and Responsible AI (RAI) are transforming healthcare by improving diagnosis accuracy, treatment planning, medical imaging, telehealth, and patient care. Covering topics such as neuroscience, disease management, and personalized medicine, it highlights how AI can enhance healthcare systems while ensuring transparency, safety, and ethical decision-making. It is a valuable resource for healthcare professionals, researchers, engineers, and IT experts working in AI-driven healthcare.",2026-05-27T11:30:10.892Z,20,true
Mathematics & Statistics,Graph Theory For Computer Science,Rajagopal,9781394302598,260.95 ,$,576,2025,General,/images/books/9781394302598.webp,,"This book explores the role of graph theory in solving modern computer science and technology challenges. It explains how graph theory helps model complex relationships in areas such as natural language processing, distributed computing, resource optimization, job scheduling, and scalable system design. By connecting multiple fields of computer science, the book demonstrates how graph theory supports data-driven decision-making and innovative computational solutions.",2026-05-27T11:30:10.892Z,20,true
General,Modern Witchcraft For Dummies,Monteagut,9781394303632,24.95 ,$,384,2025,General,/images/books/9781394303632.webp,,"Modern Witchcraft For Dummies is a beginner-friendly guide to modern witchcraft, exploring diverse spiritual paths beyond traditional Wicca and Euro-pagan practices. The book covers the history, ethics, rituals, spellcasting, altars, grimoires, and different types of witches while encouraging inclusivity and spiritual self-discovery. It is an ideal introduction for anyone curious about witchcraft and modern magical practices.",2026-05-27T11:30:10.892Z,20,true
"Business Management, Finance & Accounting","Encouraging The Heart: Igniting Purpose And Providing Meaningful Recognition, 2Nd Edition",Kouzes,9781394303908,23.95 ,$,272,2025,Management,/images/books/9781394303908.webp,,"Encouraging the Heart by James Kouzes and Barry Posner is a practical leadership guide focused on inspiring and motivating people through meaningful recognition and appreciation. Drawing on decades of leadership research and real-world examples, the book teaches leaders how to celebrate achievements, reinforce organizational values, provide personalized encouragement, and create a culture of purpose, engagement, and high performance.",2026-05-27T11:30:10.892Z,20,true
"Business Management, Finance & Accounting","The Sky'S The Limit: Lessons In Service, Entrepreneurship And Achieving The American Dream",Garner,9781394304028,29.95 ,$,208,2025,Management,/images/books/9781394304028.webp,,"Sky's the Limit by John P. Calamos Sr. is an inspiring memoir about entrepreneurship, resilience, and achieving success through hard work and risk-taking. From working in his family’s grocery store to flying combat missions in Vietnam and building a multibillion-dollar investment firm, the book shares powerful life lessons on leadership, investing, service, and pursuing the American Dream.",2026-05-27T11:30:10.892Z,20,true
"Business Management, Finance & Accounting",Intelligent Change: The Science Behind Digital Transformations,Budzier,9781394304592,34.95 ,$,224,2025,Management,/images/books/9781394304592.webp,,"Intelligent Change explores why most digital transformation projects fail and provides research-backed strategies for leading successful technology-driven change. Based on extensive studies and real-world case analyses, the book explains how organizations can improve communication, build trust, create ownership among teams, and successfully manage digital transformation initiatives that deliver real business value.",2026-05-27T11:30:10.892Z,20,true
General,"Accounting And Auditing Research: Tools And Strategies, 11Th Edition",Weirich,9781394304707,146.95 ,$,288,2025,General,/images/books/9781394304707.webp,,"Accounting and Auditing Research: Tools and Strategies (11th Edition) is a comprehensive guide to conducting effective accounting and auditing research using modern tools, databases, and AI-driven technologies. The book covers financial accounting, auditing, tax research, fraud detection, sustainability assurance, and professional research methods through practical exercises, real-world cases, and step-by-step guidance, making it ideal for students and early-career accounting professionals.",2026-05-27T11:30:10.892Z,20,true
Computer Science,Ai In Legal Tech - How Generative Ai Is Transforming Legal Technology And The Practice Of Law,Casey,9781394304721,49.95 ,$,336,2025,Computer,/images/books/9781394304721.webp,,"AI in Legal Tech by Catherine Casey explores how generative AI is transforming the legal industry, including its impact on legal practice, ethics, and careers. It offers practical insights, tools, and real-world perspectives, making it valuable for lawyers, students, and legal professionals navigating AI-driven change.",2026-05-27T11:30:10.892Z,20,true
"Business Management, Finance & Accounting",Supercharged Teams: How Every Manager Can Create A Culture Of Excellence,Jenkins,9781394305322,27.95 ,$,208,2025,Management,/images/books/9781394305322.webp,,"Super Charged Teams is a leadership guide that challenges traditional management myths and focuses on building high-performance, trust-driven teams. It offers practical frameworks and behavioral insights to help managers improve engagement, drive results, lead through change, and advance their careers while creating a strong, innovative workplace culture.",2026-05-27T11:30:10.892Z,20,true
Science,The Impact Of Algorithmic Technologies On Healthcare,Dubey,9781394305469,235.95 ,$,480,2025,General,/images/books/9781394305469.webp,,"This book explores how AI, machine learning, and IoT are transforming healthcare into a data-driven system that improves diagnosis, treatment, and patient outcomes. It also covers key technologies like digital twins, deep learning, telemedicine, wearables, blockchain, and EHR/EMR systems, along with challenges such as ethics, data security, and human-centered care, making it valuable for healthcare and technology professionals, researchers, and policymakers.",2026-05-27T11:30:10.892Z,20,true
Chemistry,"Sustainability Programs - A Design Guide To Achieving Financial, Social, And Environmental Performance",Borges,9781394307388,107.95 ,$,288,2025,General,/images/books/9781394307388.webp,,"Sustainability Programs offers a practical, step-by-step guide to building and managing organization-wide sustainability strategies focused on People, Planet, and Profit (3P). It helps businesses design structured policies, reduce risk, improve efficiency, and integrate ESG goals across departments while avoiding ineffective, ad-hoc sustainability efforts.",2026-05-27T11:30:10.892Z,20,true
General,The Executive Function Playbook: Building Independence In Kids With Adhd,Mcleod,9781394309153,31.95 ,$,224,2025,General,/images/books/9781394309153.webp,,"The Executive Function Playbook by Mike McLeod is a practical, evidence-based guide for parents, educators, and professionals supporting youth with ADHD. It provides actionable strategies to improve attention, impulse control, and time management, while offering research-backed insights into executive function challenges and effective ways to build on strengths and improve daily functioning.",2026-05-27T11:30:10.892Z,20,true
Science,Diabetes Desserts Cookbook For Dummies,Riolo,9781394309566,24.95 ,$,336,2025,General,/images/books/9781394309566.webp,,"Diabetes Desserts Cookbook For Dummies features over 125 diabetes-friendly dessert recipes that prove you don’t have to give up sweets after a diabetes diagnosis. It offers balanced, wholesome treats like cakes, cookies, and brownies with options for gluten-free, dairy-free, and vegan diets, focusing on portion control and healthier ingredients.",2026-05-27T11:30:10.892Z,20,true
"Business Management, Finance & Accounting","Enterprise Process Orchestration: A Hands-On Guide To Strategy, People, And Technology That Will Transform Your Business",Ruecker,9781394309672,45.00 ,$,304,2025,Management,/images/books/9781394309672.webp,,"Enterprise Process Orchestration is a practical guide for implementing end-to-end process orchestration across organizations to improve agility, speed, and innovation. It explains how to align strategy, choose use cases and technologies, structure teams, and measure value while integrating systems, people, and AI to drive large-scale digital transformation.",2026-05-27T11:30:10.892Z,20,true
"Business Management, Finance & Accounting","The Zen Of Business: Ancient Wisdom To Help Modern Leaders Lead With Intention, Clarity, And Purpose",Roberts,9781394309962,27.95 ,$,256,2025,Management,/images/books/9781394309962.webp,,"The Zen of Business by Keith Roberts blends ancient Buddhist wisdom with modern leadership principles to help professionals lead with clarity, purpose, and intention. It introduces concepts like Ikigai, mindfulness, and the Eightfold Path, offering practical exercises and tools to improve focus, ethical decision-making, and overall business success while aligning work with personal purpose.",2026-05-27T11:30:10.892Z,20,true
Engineering,Networked Sensing Systems,Dhanaraj,9781394310869,204.95 ,$,416,2025,Engineering,/images/books/9781394310869.webp,,"Networked Sensing Systems explores how IoT, wireless networks, and digital transformation can be used to build more sustainable and efficient systems across sectors like energy, agriculture, transport, and environmental monitoring. It focuses on energy-efficient sensing technologies and smart network design to support climate action and enable a greener, data-driven society.",2026-05-27T11:30:10.892Z,20,true
Engineering,Power Devices And Internet Of Things For Intelligent System Design,Sarkar,9781394311576,235.95 ,$,464,2025,Engineering,/images/books/9781394311576.webp,,"Power Devices and Internet of Things for Intelligent System Design explores advancements in power electronics and IoT-based systems for real-world applications. It focuses on smart, secure, and efficient technologies used in areas like healthcare, agriculture, security, and industrial systems, while also highlighting innovations in fault tolerance, blockchain integration, and intelligent system design.",2026-05-27T11:30:10.892Z,20,true
General,"Private Markets: Building Better Portfolios With Private Equity, Private Credit, And Private Real Estate",Davidow,9781394313082,44.95 ,$,288,2025,General,/images/books/9781394313082.webp,,"Private Markets by Tony Davidow explains how private equity, private credit, and private real estate can be used to build stronger, more diversified investment portfolios. It covers their risks, returns, and benefits—such as higher potential income, inflation protection, and diversification—while guiding advisors and investors on how to incorporate private market assets into long-term financial strategies.",2026-05-27T11:30:10.892Z,20,true
